{
  "format": "nova3d.visual-baseline",
  "version": 1,
  "scene": "city-benchmark",
  "captureVersion": 1,
  "image": "baseline.png",
  "captureMetadata": "baseline.capture.json",
  "imageSha256": "253d68c438e08fab3521f7c94cda30f54dbf034d0b2d8859d2d92f74e1eb8bed",
  "captureMetadataSha256": "eaf0a06badf742abddd054476b762702c280c02e101f807be092a7a5fd954f3d",
  "channelTolerance": 2,
  "maxDifferentPixelRatio": 0.001,
  "environment": {
    "backend": "DesktopGL",
    "graphicsAdapter": "NVIDIA GeForce GTX 1660 SUPER/PCIe/SSE2",
    "graphicsProfile": "HiDef",
    "backBufferFormat": "Color",
    "depthStencilFormat": "Depth24",
    "multiSampleCount": 0,
    "operatingSystem": "Microsoft Windows 10.0.19045",
    "processArchitecture": "X64"
  }
}