{
  "format": "nova3d.visual-baseline",
  "version": 1,
  "scene": "gltf-static-animated",
  "captureVersion": 1,
  "image": "baseline.png",
  "captureMetadata": "baseline.capture.json",
  "imageSha256": "1553b3b5977aa5874f83cf417d5c7a2aa176a34a45de57512bc53323c4752222",
  "captureMetadataSha256": "505045a980f5e89aac60789ce3a031a283ac53ecc9e1abcec08324c603997682",
  "channelTolerance": 2,
  "maxDifferentPixelRatio": 0.001,
  "environment": {
    "backend": "DesktopGL",
    "graphicsAdapter": "NVIDIA GeForce GTX 1660 SUPER/PCIe/SSE2",
    "graphicsProfile": "HiDef",
    "backBufferFormat": "Color",
    "depthStencilFormat": "Depth24",
    "multiSampleCount": 0,
    "operatingSystem": "Microsoft Windows 10.0.19045",
    "processArchitecture": "X64"
  }
}